{
  "schema_kind": "odd_world_model.semantic_publication_candidate",
  "schema_version": "v1",
  "publication_candidate_ref": "publication-candidate:semantic-cut://odd_world_model/sandbox/apra_liquidity_model/v1",
  "semantic_cut_ref": "semantic-cut://odd_world_model/sandbox/apra_liquidity_model/v1",
  "cut_role": "domain_artifact",
  "cut_version": "v1",
  "publication_status": "ready_for_publication",
  "epistemic_status": "candidate",
  "source_observation": {
    "ref": "source-observation://odd_world_model/sandbox/apra_liquidity_model/v1",
    "digest": "sha256:d633dfcec359ec5b8c886114548f118dd4de26280f09ee08adb86ad8a30a4caf"
  },
  "accepted_semantic_cut": {
    "ref": "semantic-cut://odd_world_model/sandbox/apra_liquidity_model/v1",
    "digest": "sha256:adf707f048f96da415298604c328320d33ae2ec10aa34b02f454e4e8c1705280",
    "version": "v1"
  },
  "semantic_cut_attestation": {
    "ref": "attestation:write://odd_world_model/sandbox/apra_liquidity_model/v1",
    "digest": "sha256:97226fce6f4a14400dc2ebd2e19c4c68661c4582dc876ebdd9ba873f334b682b"
  },
  "physical_effect_observation": {
    "ref": "physical-effect-observation:attestation:write://odd_world_model/sandbox/apra_liquidity_model/v1:2026-07-12T14:28:31.421Z",
    "digest": "sha256:c6bf4d9e058773b605d8fc37d2fd1efcf71d7df02259fb4e7a3d53bb7f38e141"
  },
  "physical_admission_witness": {
    "ref": "admission-witness://odd_world_model/sandbox/apra_liquidity_model-physical-v1",
    "digest": "sha256:3733c5eff76efa42c898282e1f68292f103a141e034e3154fc73b7c8ff000911"
  },
  "snapshot_refs": [
    {
      "ref": "iceberg-snapshot://wm.semantic_publications/1101020722820305058",
      "digest": "sha256:d08c5aedb965f30683ebe39da6bfa834582a4f6889f11466a696a0ac69c3d598",
      "version": "file:///Users/jim/src/apps/odd_world_model/examples/apra_liquidity_model/sandbox/20260712T142827Z_0.0.0-development.f94aa30.dirty.cc665fcae1.TS/physical/runtime/warehouse/wm/semantic_publications/metadata/00001-7c02e006-5d1b-4579-8dc7-c7ef96f81c7b.metadata.json"
    }
  ],
  "semantic_payload_digest": "sha256:0f16c60342a23fdb42d10620ee0e7b7cd49abded775d37cf02b9fd5914f2eaee",
  "governing_refs": [
    "specification/PRODUCT.md",
    "specification/requirements/40-domain-build-verification.md",
    "build_tenants/common/design/adrs/ADR-WM-006-versioned-installed-product-example-sandboxes.md"
  ],
  "source_refs": [
    "source-corpus://odd_world_model/apra_liquidity_model/v1"
  ],
  "authority_refs": [
    "authority://odd_world_model/apra-liquidity-example/v1"
  ],
  "dependency_identities": [
    "@abiogenesis/typescript-tenant@4.6.0-rc.3#sha256:9cffb372c0dfc00983a5d0e882efbc3d0c3ac937a56f313000f35a4473358113",
    "@odd-glc/route-one-typescript@0.1.0#sha256:7e548f92ecd6b4442f9c9f1feb46dd2edd7e9610a7dae8706482fc65d80fa578",
    "fast-xml-parser@5.10.0#digest-not-published",
    "fast-xml-validator@1.2.0#digest-not-published",
    "json-canonicalize@2.0.0#digest-not-published",
    "odd-world-model-storage@0.1.0#sha256:8a0b494395099062a87094f02beec86f911d95725b9283105fe2729e56a5fa41",
    "duckdb@1.4.5#digest-not-published",
    "pyiceberg@0.11.1#digest-not-published",
    "rfc8785@0.1.4#digest-not-published"
  ],
  "temporal_coordinates": {
    "observed_at": "2026-07-12T14:28:27.645Z",
    "accepted_at": "2026-07-12T14:28:27.645Z"
  },
  "fidelity": "lossy_projection",
  "losses": [
    "official APRA HTML and PDF sources are inventoried while this deterministic adapter consumes only the bounded retained claims and requirement snapshot"
  ],
  "exclusions": [
    "source-evidence://apra_liquidity_model/uninterpreted-primary-documents"
  ],
  "gaps": [],
  "publication_candidate_digest": "sha256:01158deba2880f6cdfe0d41279ce5421588c464875548b62499f5c2f73079534"
}
