{
  "schema_kind": "odd_world_model.semantic_publication_candidate",
  "schema_version": "v1",
  "publication_candidate_ref": "publication-candidate:semantic-cut://odd_world_model/sandbox/trade_representation_model/v1",
  "semantic_cut_ref": "semantic-cut://odd_world_model/sandbox/trade_representation_model/v1",
  "cut_role": "domain_artifact",
  "cut_version": "v1",
  "publication_status": "ready_for_publication",
  "epistemic_status": "candidate",
  "source_observation": {
    "ref": "source-observation://odd_world_model/sandbox/trade_representation_model/v1",
    "digest": "sha256:2cb7316fd3a6582d746e6cb5899d69d8543ef3e17b981a04f3b7520e2d63230f"
  },
  "accepted_semantic_cut": {
    "ref": "semantic-cut://odd_world_model/sandbox/trade_representation_model/v1",
    "digest": "sha256:57a94e2cbaf57214aca30fd6184f8c7217b8b879ca6914d4f30c6a46ed48cc6c",
    "version": "v1"
  },
  "semantic_cut_attestation": {
    "ref": "attestation:write://odd_world_model/sandbox/trade_representation_model/v1",
    "digest": "sha256:c393a1018359e0b65432d80c56c25f51a1130cfd7811e035a9854d0bfe734bba"
  },
  "physical_effect_observation": {
    "ref": "physical-effect-observation:attestation:write://odd_world_model/sandbox/trade_representation_model/v1:2026-07-12T14:28:29.432Z",
    "digest": "sha256:d721da60824c9b194d92797984b814f96bc038058943820c53dc2e1f81f27986"
  },
  "physical_admission_witness": {
    "ref": "admission-witness://odd_world_model/sandbox/trade_representation_model-physical-v1",
    "digest": "sha256:39e51f1a0182e50af35d8024a03f7a5533a8d5f81553625b10a47bc419f248ef"
  },
  "snapshot_refs": [
    {
      "ref": "iceberg-snapshot://wm.semantic_publications/7124086183510039804",
      "digest": "sha256:8f4d8dc84957cee4291c0feee64fb59367dcd63d4d7f11f470a69ae0357a69bb",
      "version": "file:///Users/jim/src/apps/odd_world_model/examples/trade_representation_model/sandbox/20260712T142827Z_0.0.0-development.f94aa30.dirty.cc665fcae1.TS/physical/runtime/warehouse/wm/semantic_publications/metadata/00001-71b41b83-4a27-42dc-8597-03f73e9401e8.metadata.json"
    }
  ],
  "semantic_payload_digest": "sha256:84503976af60a9efda7d52e98b36e77ae54bfcf32d396be8b0786f827fe06104",
  "governing_refs": [
    "specification/PRODUCT.md",
    "specification/requirements/40-domain-build-verification.md",
    "build_tenants/common/design/adrs/ADR-WM-006-versioned-installed-product-example-sandboxes.md"
  ],
  "source_refs": [
    "source-corpus://odd_world_model/trade_representation_model/v1"
  ],
  "authority_refs": [
    "authority://odd_world_model/trade-representation-example/v1"
  ],
  "dependency_identities": [
    "@abiogenesis/typescript-tenant@4.6.0-rc.3#sha256:9cffb372c0dfc00983a5d0e882efbc3d0c3ac937a56f313000f35a4473358113",
    "@odd-glc/route-one-typescript@0.1.0#sha256:7e548f92ecd6b4442f9c9f1feb46dd2edd7e9610a7dae8706482fc65d80fa578",
    "fast-xml-parser@5.10.0#digest-not-published",
    "fast-xml-validator@1.2.0#digest-not-published",
    "json-canonicalize@2.0.0#digest-not-published",
    "odd-world-model-storage@0.1.0#sha256:8a0b494395099062a87094f02beec86f911d95725b9283105fe2729e56a5fa41",
    "duckdb@1.4.5#digest-not-published",
    "pyiceberg@0.11.1#digest-not-published",
    "rfc8785@0.1.4#digest-not-published"
  ],
  "temporal_coordinates": {
    "observed_at": "2026-07-12T14:28:27.645Z",
    "accepted_at": "2026-07-12T14:28:27.645Z"
  },
  "fidelity": "lossy_projection",
  "losses": [
    "authority notes are inventoried but not semantically interpreted by the deterministic example adapter"
  ],
  "exclusions": [
    "source-evidence://trade_representation_model/authority-notes"
  ],
  "gaps": [],
  "publication_candidate_digest": "sha256:a776949b25e7f653115e1b14099c2e8184ffc53ca6efa83cb59cdc03e9904b4d"
}
