{
  "schema_kind": "odd_world_model.semantic_publication_candidate",
  "schema_version": "v1",
  "publication_candidate_ref": "publication-candidate:semantic-cut://odd_world_model/sandbox/trade_source_model/v1",
  "semantic_cut_ref": "semantic-cut://odd_world_model/sandbox/trade_source_model/v1",
  "cut_role": "domain_artifact",
  "cut_version": "v1",
  "publication_status": "ready_for_publication",
  "epistemic_status": "candidate",
  "source_observation": {
    "ref": "source-observation://odd_world_model/sandbox/trade_source_model/v1",
    "digest": "sha256:9beb02f0eb66137b7cb55b8b0c46c316e62027fd1bb55c771c23e78493fb4234"
  },
  "accepted_semantic_cut": {
    "ref": "semantic-cut://odd_world_model/sandbox/trade_source_model/v1",
    "digest": "sha256:98353e2045b4bcb468040227175bf50f204c687b1c7e4d2e4780eaaae5f3dc6d",
    "version": "v1"
  },
  "semantic_cut_attestation": {
    "ref": "attestation:write://odd_world_model/sandbox/trade_source_model/v1",
    "digest": "sha256:9b39c6e33733e3b7c54d640fcae2f21945f4af19de249478a4178dcd479241bb"
  },
  "physical_effect_observation": {
    "ref": "physical-effect-observation:attestation:write://odd_world_model/sandbox/trade_source_model/v1:2026-07-12T14:28:28.421Z",
    "digest": "sha256:017559eed39ac6636c7f6a2266205f3e66e85ac021344b63cc951e430aa709d2"
  },
  "physical_admission_witness": {
    "ref": "admission-witness://odd_world_model/sandbox/trade_source_model-physical-v1",
    "digest": "sha256:e42891f716331340673dbe284c02aeeddc7a86402efd4afbc6f65bd93c5b20db"
  },
  "snapshot_refs": [
    {
      "ref": "iceberg-snapshot://wm.semantic_publications/803815983928620142",
      "digest": "sha256:e242490f9d7db0138565f6ac7346718534d5ef6ff97e6e29ed82bc0ab3f998d9",
      "version": "file:///Users/jim/src/apps/odd_world_model/examples/trade_source_model/sandbox/20260712T142827Z_0.0.0-development.f94aa30.dirty.cc665fcae1.TS/physical/runtime/warehouse/wm/semantic_publications/metadata/00001-98d097e5-6c9a-45dd-a027-7a2b39d9ce14.metadata.json"
    }
  ],
  "semantic_payload_digest": "sha256:6390becdcfe24d309b97624cda708f5a0c29fc2ec2c28e59048572ad85c79e90",
  "governing_refs": [
    "specification/PRODUCT.md",
    "specification/requirements/40-domain-build-verification.md",
    "build_tenants/common/design/adrs/ADR-WM-006-versioned-installed-product-example-sandboxes.md"
  ],
  "source_refs": [
    "source-corpus://odd_world_model/trade_source_model/v1"
  ],
  "authority_refs": [
    "authority://fpml/official-example-corpus"
  ],
  "dependency_identities": [
    "@abiogenesis/typescript-tenant@4.6.0-rc.3#sha256:9cffb372c0dfc00983a5d0e882efbc3d0c3ac937a56f313000f35a4473358113",
    "@odd-glc/route-one-typescript@0.1.0#sha256:7e548f92ecd6b4442f9c9f1feb46dd2edd7e9610a7dae8706482fc65d80fa578",
    "fast-xml-parser@5.10.0#digest-not-published",
    "fast-xml-validator@1.2.0#digest-not-published",
    "json-canonicalize@2.0.0#digest-not-published",
    "odd-world-model-storage@0.1.0#sha256:8a0b494395099062a87094f02beec86f911d95725b9283105fe2729e56a5fa41",
    "duckdb@1.4.5#digest-not-published",
    "pyiceberg@0.11.1#digest-not-published",
    "rfc8785@0.1.4#digest-not-published"
  ],
  "temporal_coordinates": {
    "observed_at": "2026-07-12T14:28:27.645Z",
    "accepted_at": "2026-07-12T14:28:27.645Z"
  },
  "fidelity": "lossy_projection",
  "losses": [
    "FpML syntax, example-index content, and non-economic documentation are inventoried but not copied into the interpreted trade payload"
  ],
  "exclusions": [
    "source-evidence://trade_source_model/uninterpreted-documentation"
  ],
  "gaps": [],
  "publication_candidate_digest": "sha256:d2265be1978be40fe53839145b085d3d9dcf6f15e95b88665f0b1149ec58f3cd"
}
